{
  "schema_version": 1,
  "work_item_id": "WI-001",
  "phase": "DEFINE",
  "run_status": "PAUSED",
  "step": "bootstrap",
  "round": 0,
  "max_rounds": 40,
  "gate_failures_here": 0,
  "max_gate_failures": 3,
  "autonomy": "supervised",
  "started_epoch": 0,
  "max_wall_seconds": 14400,
  "gates": {
    "DEFINE": {"status": "PENDING", "evidence_ids": []},
    "DESIGN": {"status": "PENDING", "evidence_ids": []},
    "EXECUTE": {"status": "PENDING", "evidence_ids": []},
    "REVIEW": {"status": "PENDING", "evidence_ids": []},
    "VALIDATE": {"status": "PENDING", "evidence_ids": []},
    "HANDOVER": {"status": "PENDING", "evidence_ids": []}
  },
  "last_result": "Template is not configured.",
  "next_action": "Complete the supervised bootstrap protocol.",
  "updated_at": "2000-01-01T00:00:00Z"
}
